{
  "allocations": [
    {
      "action": "OPEN",
      "allocatedFeeByAsset": {
        "FEECOIN": {
          "scale": 3,
          "unscaled": "1"
        }
      },
      "allocatedQuantity": {
        "scale": 0,
        "unscaled": "1"
      },
      "allocatedReportedPnl": {
        "scale": 0,
        "unscaled": "0"
      },
      "episodeId": "ep:different-fee-asset:01",
      "executionRecordId": "different-fee-asset:trade:910000001401:execution",
      "feeRecordId": "different-fee-asset:trade:910000001401:fee",
      "reportedPnlRecordId": "different-fee-asset:trade:910000001401:pnl",
      "sourceProvenance": [
        {
          "artifactRole": "TRADE_HISTORY",
          "sourceRecordKey": "trade:AAAUSDT:910000001401",
          "sourceRowNumber": 1
        }
      ]
    },
    {
      "action": "CLOSE",
      "allocatedFeeByAsset": {
        "USDT": {
          "scale": 2,
          "unscaled": "0"
        }
      },
      "allocatedQuantity": {
        "scale": 0,
        "unscaled": "1"
      },
      "allocatedReportedPnl": {
        "scale": 2,
        "unscaled": "200"
      },
      "episodeId": "ep:different-fee-asset:01",
      "executionRecordId": "different-fee-asset:trade:910000001402:execution",
      "feeRecordId": "different-fee-asset:trade:910000001402:fee",
      "reportedPnlRecordId": "different-fee-asset:trade:910000001402:pnl",
      "sourceProvenance": [
        {
          "artifactRole": "TRADE_HISTORY",
          "sourceRecordKey": "trade:AAAUSDT:910000001402",
          "sourceRowNumber": 2
        }
      ]
    }
  ],
  "canonicalManifestHash": "b18f3e08fcd96414dfebbdeda931f1d45f6cd4c78904190d1d832270da3d0703",
  "canonicalManifestHashInputs": {
    "canonicalRecordContentHash": "8ad925440b139e0b6f00623ea8c8aec0deea2256dc83ddfbeb511cb34d961c80",
    "instrumentTermsHash": "5e458341f034961318f4d5d33cedda47717979a8480d3c7f1c05ef8031f0aad5",
    "normalizerVersion": "fixture-v1",
    "reconstructionPolicyVersion": "BINANCE_USDS_LINEAR_PERPETUAL_ONE_WAY_V1",
    "sourceArtifactHashes": {
      "POSITION_HISTORY": "ab8c80a387a680248c186dbd0ba94633ddb1a844feae267684878b1c5b239a6c",
      "TRADE_HISTORY": "12e4eedd85862fe1e7ec985c13593622410b38131d5d4800cf65c3663e4bf40b"
    }
  },
  "conservation": {
    "feesByAsset": "PASSED",
    "passed": true,
    "quantity": "PASSED",
    "reportedPnl": "PASSED"
  },
  "episodes": [
    {
      "averageEntryPrice": {
        "denominator": {
          "scale": 0,
          "unscaled": "1"
        },
        "numerator": {
          "scale": 2,
          "unscaled": "1000"
        }
      },
      "averageExitPrice": {
        "denominator": {
          "scale": 0,
          "unscaled": "1"
        },
        "numerator": {
          "scale": 2,
          "unscaled": "1200"
        }
      },
      "capabilities": [
        "FEES",
        "INITIAL_EXPOSURE",
        "MAX_EXPOSURE",
        "POSITION_INCREASES",
        "POSITION_MODE_OBSERVED_COMPATIBLE",
        "POSITION_MODE_USER_DECLARED",
        "VENUE_POSITION_SUMMARY",
        "VENUE_REPORTED_PNL"
      ],
      "closedAt": "2026-01-02T01:05:01.000000Z",
      "closingVolume": {
        "scale": 0,
        "unscaled": "1"
      },
      "direction": "LONG",
      "eligible": false,
      "episodeId": "ep:different-fee-asset:01",
      "exclusionReasons": [
        "MISSING_CAPABILITY"
      ],
      "executionRecordIds": [
        "different-fee-asset:trade:910000001401:execution",
        "different-fee-asset:trade:910000001402:execution"
      ],
      "grossTradingPnl": {
        "scale": 2,
        "unscaled": "200"
      },
      "initialNotional": {
        "scale": 2,
        "unscaled": "1000"
      },
      "initialQuantity": {
        "scale": 0,
        "unscaled": "1"
      },
      "instrumentId": "BINANCE:USDS_FUTURES:AAAUSDT",
      "maxNotional": {
        "scale": 2,
        "unscaled": "1000"
      },
      "maxQuantity": {
        "scale": 0,
        "unscaled": "1"
      },
      "netTradingPnl": null,
      "openedAt": "2026-01-02T01:00:01.000000Z",
      "openingVolume": {
        "scale": 0,
        "unscaled": "1"
      },
      "reconciliationStatus": "EXACT",
      "reconstructionStatus": "COMPLETE",
      "sourceProvenance": [
        {
          "artifactRole": "TRADE_HISTORY",
          "sourceRecordKey": "trade:AAAUSDT:910000001401",
          "sourceRowNumber": 1
        },
        {
          "artifactRole": "TRADE_HISTORY",
          "sourceRecordKey": "trade:AAAUSDT:910000001402",
          "sourceRowNumber": 2
        },
        {
          "artifactRole": "POSITION_HISTORY",
          "sourceRecordKey": "position:position-history:1",
          "sourceRowNumber": 1
        }
      ],
      "tradingFeesByAsset": {
        "FEECOIN": {
          "scale": 3,
          "unscaled": "1"
        },
        "USDT": {
          "scale": 2,
          "unscaled": "0"
        }
      },
      "venuePositionSummaryRecordIds": [
        "different-fee-asset:position:1:summary"
      ]
    }
  ],
  "fixtureId": "different-fee-asset",
  "importResult": {
    "accepted": true,
    "failureCode": null
  },
  "manifestSchemaVersion": "1.0.0",
  "normalizerVersion": "fixture-v1",
  "orderedExecutionKeysByInstrument": {
    "BINANCE:USDS_FUTURES:AAAUSDT": [
      "trade:AAAUSDT:910000001401",
      "trade:AAAUSDT:910000001402"
    ]
  },
  "reconstructionPolicyVersion": "BINANCE_USDS_LINEAR_PERPETUAL_ONE_WAY_V1",
  "summaryMatches": [
    {
      "candidateEpisodeIds": [
        "ep:different-fee-asset:01"
      ],
      "deltas": {
        "grossTradingPnl": {
          "scale": 0,
          "unscaled": "0"
        }
      },
      "episodeId": "ep:different-fee-asset:01",
      "exclusionReason": null,
      "sourceProvenance": [
        {
          "artifactRole": "POSITION_HISTORY",
          "sourceRecordKey": "position:position-history:1",
          "sourceRowNumber": 1
        }
      ],
      "status": "EXACT",
      "summaryRecordId": "different-fee-asset:position:1:summary",
      "summarySourceRow": 1,
      "tolerances": {
        "money": {
          "scale": 3,
          "unscaled": "5"
        },
        "price": {
          "scale": 3,
          "unscaled": "5"
        },
        "quantity": {
          "scale": 1,
          "unscaled": "5"
        }
      }
    }
  ]
}
