{
  "allocations": [
    {
      "action": "OPEN",
      "allocatedFeeByAsset": {
        "USDT": {
          "scale": 2,
          "unscaled": "0"
        }
      },
      "allocatedQuantity": {
        "scale": 0,
        "unscaled": "1"
      },
      "allocatedReportedPnl": {
        "scale": 0,
        "unscaled": "0"
      },
      "episodeId": "ep:duplicate-execution-same-content:01",
      "executionRecordId": "duplicate-execution-same-content:trade:910000001601:execution",
      "feeRecordId": "duplicate-execution-same-content:trade:910000001601:fee",
      "reportedPnlRecordId": "duplicate-execution-same-content:trade:910000001601:pnl",
      "sourceProvenance": [
        {
          "artifactRole": "TRADE_HISTORY",
          "sourceRecordKey": "trade:AAAUSDT:910000001601",
          "sourceRowNumber": 1
        }
      ]
    },
    {
      "action": "CLOSE",
      "allocatedFeeByAsset": {
        "USDT": {
          "scale": 2,
          "unscaled": "0"
        }
      },
      "allocatedQuantity": {
        "scale": 0,
        "unscaled": "1"
      },
      "allocatedReportedPnl": {
        "scale": 2,
        "unscaled": "100"
      },
      "episodeId": "ep:duplicate-execution-same-content:01",
      "executionRecordId": "duplicate-execution-same-content:trade:910000001602:execution",
      "feeRecordId": "duplicate-execution-same-content:trade:910000001602:fee",
      "reportedPnlRecordId": "duplicate-execution-same-content:trade:910000001602:pnl",
      "sourceProvenance": [
        {
          "artifactRole": "TRADE_HISTORY",
          "sourceRecordKey": "trade:AAAUSDT:910000001602",
          "sourceRowNumber": 3
        }
      ]
    }
  ],
  "canonicalManifestHash": "d7119b47fa5befcb852e09a03ef8276644a1d0ea09bbe4da8782c982b36f50c2",
  "canonicalManifestHashInputs": {
    "canonicalRecordContentHash": "96890f3960d1f25fa1546c1b6298bf4e0a88bd8c92a5042dcbc6d437986b1181",
    "instrumentTermsHash": "5e458341f034961318f4d5d33cedda47717979a8480d3c7f1c05ef8031f0aad5",
    "normalizerVersion": "fixture-v1",
    "reconstructionPolicyVersion": "BINANCE_USDS_LINEAR_PERPETUAL_ONE_WAY_V1",
    "sourceArtifactHashes": {
      "POSITION_HISTORY": "d293360194889158534af746a866aed31bbd06656fafd72231e25d8d6c498e81",
      "TRADE_HISTORY": "6f6ccc027a8d5b3204056381e66c002eda626aab3aa99d0d6793724357b41dd5"
    }
  },
  "conservation": {
    "feesByAsset": "PASSED",
    "passed": true,
    "quantity": "PASSED",
    "reportedPnl": "PASSED"
  },
  "episodes": [
    {
      "averageEntryPrice": {
        "denominator": {
          "scale": 0,
          "unscaled": "1"
        },
        "numerator": {
          "scale": 2,
          "unscaled": "1000"
        }
      },
      "averageExitPrice": {
        "denominator": {
          "scale": 0,
          "unscaled": "1"
        },
        "numerator": {
          "scale": 2,
          "unscaled": "1100"
        }
      },
      "capabilities": [
        "CLOSED_OUTCOME",
        "FEES",
        "INITIAL_EXPOSURE",
        "MAX_EXPOSURE",
        "POSITION_INCREASES",
        "POSITION_MODE_OBSERVED_COMPATIBLE",
        "POSITION_MODE_USER_DECLARED",
        "VENUE_POSITION_SUMMARY",
        "VENUE_REPORTED_PNL"
      ],
      "closedAt": "2026-01-02T01:05:01.000000Z",
      "closingVolume": {
        "scale": 0,
        "unscaled": "1"
      },
      "direction": "LONG",
      "eligible": true,
      "episodeId": "ep:duplicate-execution-same-content:01",
      "exclusionReasons": [],
      "executionRecordIds": [
        "duplicate-execution-same-content:trade:910000001601:execution",
        "duplicate-execution-same-content:trade:910000001602:execution"
      ],
      "grossTradingPnl": {
        "scale": 2,
        "unscaled": "100"
      },
      "initialNotional": {
        "scale": 2,
        "unscaled": "1000"
      },
      "initialQuantity": {
        "scale": 0,
        "unscaled": "1"
      },
      "instrumentId": "BINANCE:USDS_FUTURES:AAAUSDT",
      "maxNotional": {
        "scale": 2,
        "unscaled": "1000"
      },
      "maxQuantity": {
        "scale": 0,
        "unscaled": "1"
      },
      "netTradingPnl": {
        "scale": 2,
        "unscaled": "100"
      },
      "openedAt": "2026-01-02T01:00:01.000000Z",
      "openingVolume": {
        "scale": 0,
        "unscaled": "1"
      },
      "reconciliationStatus": "EXACT",
      "reconstructionStatus": "COMPLETE",
      "sourceProvenance": [
        {
          "artifactRole": "TRADE_HISTORY",
          "sourceRecordKey": "trade:AAAUSDT:910000001601",
          "sourceRowNumber": 1
        },
        {
          "artifactRole": "TRADE_HISTORY",
          "sourceRecordKey": "trade:AAAUSDT:910000001601",
          "sourceRowNumber": 2
        },
        {
          "artifactRole": "TRADE_HISTORY",
          "sourceRecordKey": "trade:AAAUSDT:910000001602",
          "sourceRowNumber": 3
        },
        {
          "artifactRole": "POSITION_HISTORY",
          "sourceRecordKey": "position:position-history:1",
          "sourceRowNumber": 1
        }
      ],
      "tradingFeesByAsset": {
        "USDT": {
          "scale": 2,
          "unscaled": "0"
        }
      },
      "venuePositionSummaryRecordIds": [
        "duplicate-execution-same-content:position:1:summary"
      ]
    }
  ],
  "fixtureId": "duplicate-execution-same-content",
  "importResult": {
    "accepted": true,
    "failureCode": null
  },
  "manifestSchemaVersion": "1.0.0",
  "normalizerVersion": "fixture-v1",
  "orderedExecutionKeysByInstrument": {
    "BINANCE:USDS_FUTURES:AAAUSDT": [
      "trade:AAAUSDT:910000001601",
      "trade:AAAUSDT:910000001602"
    ]
  },
  "reconstructionPolicyVersion": "BINANCE_USDS_LINEAR_PERPETUAL_ONE_WAY_V1",
  "summaryMatches": [
    {
      "candidateEpisodeIds": [
        "ep:duplicate-execution-same-content:01"
      ],
      "deltas": {
        "grossTradingPnl": {
          "scale": 0,
          "unscaled": "0"
        }
      },
      "episodeId": "ep:duplicate-execution-same-content:01",
      "exclusionReason": null,
      "sourceProvenance": [
        {
          "artifactRole": "POSITION_HISTORY",
          "sourceRecordKey": "position:position-history:1",
          "sourceRowNumber": 1
        }
      ],
      "status": "EXACT",
      "summaryRecordId": "duplicate-execution-same-content:position:1:summary",
      "summarySourceRow": 1,
      "tolerances": {
        "money": {
          "scale": 3,
          "unscaled": "5"
        },
        "price": {
          "scale": 3,
          "unscaled": "5"
        },
        "quantity": {
          "scale": 1,
          "unscaled": "5"
        }
      }
    }
  ]
}
