{
  "allocations": [
    {
      "action": "OPEN",
      "allocatedFeeByAsset": {
        "USDT": {
          "scale": 2,
          "unscaled": "0"
        }
      },
      "allocatedQuantity": {
        "scale": 0,
        "unscaled": "1"
      },
      "allocatedReportedPnl": {
        "scale": 0,
        "unscaled": "0"
      },
      "episodeId": "ep:partial-entry:01",
      "executionRecordId": "partial-entry:trade:910000000301:execution",
      "feeRecordId": "partial-entry:trade:910000000301:fee",
      "reportedPnlRecordId": "partial-entry:trade:910000000301:pnl",
      "sourceProvenance": [
        {
          "artifactRole": "TRADE_HISTORY",
          "sourceRecordKey": "trade:AAAUSDT:910000000301",
          "sourceRowNumber": 1
        }
      ]
    },
    {
      "action": "INCREASE",
      "allocatedFeeByAsset": {
        "USDT": {
          "scale": 2,
          "unscaled": "0"
        }
      },
      "allocatedQuantity": {
        "scale": 0,
        "unscaled": "2"
      },
      "allocatedReportedPnl": {
        "scale": 0,
        "unscaled": "0"
      },
      "episodeId": "ep:partial-entry:01",
      "executionRecordId": "partial-entry:trade:910000000302:execution",
      "feeRecordId": "partial-entry:trade:910000000302:fee",
      "reportedPnlRecordId": "partial-entry:trade:910000000302:pnl",
      "sourceProvenance": [
        {
          "artifactRole": "TRADE_HISTORY",
          "sourceRecordKey": "trade:AAAUSDT:910000000302",
          "sourceRowNumber": 2
        }
      ]
    },
    {
      "action": "CLOSE",
      "allocatedFeeByAsset": {
        "USDT": {
          "scale": 2,
          "unscaled": "0"
        }
      },
      "allocatedQuantity": {
        "scale": 0,
        "unscaled": "3"
      },
      "allocatedReportedPnl": {
        "scale": 2,
        "unscaled": "600"
      },
      "episodeId": "ep:partial-entry:01",
      "executionRecordId": "partial-entry:trade:910000000303:execution",
      "feeRecordId": "partial-entry:trade:910000000303:fee",
      "reportedPnlRecordId": "partial-entry:trade:910000000303:pnl",
      "sourceProvenance": [
        {
          "artifactRole": "TRADE_HISTORY",
          "sourceRecordKey": "trade:AAAUSDT:910000000303",
          "sourceRowNumber": 3
        }
      ]
    }
  ],
  "canonicalManifestHash": "9f87b3e36a4d1e15d83bfce382b196555cd86dd8fadb146ee270f55d17c9fb8a",
  "canonicalManifestHashInputs": {
    "canonicalRecordContentHash": "c57ab6258242d2c383f0987fdea6cbafc42650526e175d160ac1c959d944c968",
    "instrumentTermsHash": "5e458341f034961318f4d5d33cedda47717979a8480d3c7f1c05ef8031f0aad5",
    "normalizerVersion": "fixture-v1",
    "reconstructionPolicyVersion": "BINANCE_USDS_LINEAR_PERPETUAL_ONE_WAY_V1",
    "sourceArtifactHashes": {
      "POSITION_HISTORY": "fa04afba8c5e82f0902076c2de22eb0d19d826756d6f90e0b2e3d58343772c17",
      "TRADE_HISTORY": "5a30b5a99fb20b86014dfce9255a041b7d53c4986f00240325c9f299fc8f0fc0"
    }
  },
  "conservation": {
    "feesByAsset": "PASSED",
    "passed": true,
    "quantity": "PASSED",
    "reportedPnl": "PASSED"
  },
  "episodes": [
    {
      "averageEntryPrice": {
        "denominator": {
          "scale": 0,
          "unscaled": "3"
        },
        "numerator": {
          "scale": 2,
          "unscaled": "3600"
        }
      },
      "averageExitPrice": {
        "denominator": {
          "scale": 0,
          "unscaled": "3"
        },
        "numerator": {
          "scale": 2,
          "unscaled": "4200"
        }
      },
      "capabilities": [
        "CLOSED_OUTCOME",
        "FEES",
        "INITIAL_EXPOSURE",
        "MAX_EXPOSURE",
        "POSITION_INCREASES",
        "POSITION_MODE_OBSERVED_COMPATIBLE",
        "POSITION_MODE_USER_DECLARED",
        "VENUE_POSITION_SUMMARY",
        "VENUE_REPORTED_PNL"
      ],
      "closedAt": "2026-01-02T01:02:01.000000Z",
      "closingVolume": {
        "scale": 0,
        "unscaled": "3"
      },
      "direction": "LONG",
      "eligible": true,
      "episodeId": "ep:partial-entry:01",
      "exclusionReasons": [],
      "executionRecordIds": [
        "partial-entry:trade:910000000301:execution",
        "partial-entry:trade:910000000302:execution",
        "partial-entry:trade:910000000303:execution"
      ],
      "grossTradingPnl": {
        "scale": 2,
        "unscaled": "600"
      },
      "initialNotional": {
        "scale": 2,
        "unscaled": "1000"
      },
      "initialQuantity": {
        "scale": 0,
        "unscaled": "1"
      },
      "instrumentId": "BINANCE:USDS_FUTURES:AAAUSDT",
      "maxNotional": {
        "scale": 2,
        "unscaled": "3600"
      },
      "maxQuantity": {
        "scale": 0,
        "unscaled": "3"
      },
      "netTradingPnl": {
        "scale": 2,
        "unscaled": "600"
      },
      "openedAt": "2026-01-02T01:00:01.000000Z",
      "openingVolume": {
        "scale": 0,
        "unscaled": "3"
      },
      "reconciliationStatus": "EXACT",
      "reconstructionStatus": "COMPLETE",
      "sourceProvenance": [
        {
          "artifactRole": "TRADE_HISTORY",
          "sourceRecordKey": "trade:AAAUSDT:910000000301",
          "sourceRowNumber": 1
        },
        {
          "artifactRole": "TRADE_HISTORY",
          "sourceRecordKey": "trade:AAAUSDT:910000000302",
          "sourceRowNumber": 2
        },
        {
          "artifactRole": "TRADE_HISTORY",
          "sourceRecordKey": "trade:AAAUSDT:910000000303",
          "sourceRowNumber": 3
        },
        {
          "artifactRole": "POSITION_HISTORY",
          "sourceRecordKey": "position:position-history:1",
          "sourceRowNumber": 1
        }
      ],
      "tradingFeesByAsset": {
        "USDT": {
          "scale": 2,
          "unscaled": "0"
        }
      },
      "venuePositionSummaryRecordIds": [
        "partial-entry:position:1:summary"
      ]
    }
  ],
  "fixtureId": "partial-entry",
  "importResult": {
    "accepted": true,
    "failureCode": null
  },
  "manifestSchemaVersion": "1.0.0",
  "normalizerVersion": "fixture-v1",
  "orderedExecutionKeysByInstrument": {
    "BINANCE:USDS_FUTURES:AAAUSDT": [
      "trade:AAAUSDT:910000000301",
      "trade:AAAUSDT:910000000302",
      "trade:AAAUSDT:910000000303"
    ]
  },
  "reconstructionPolicyVersion": "BINANCE_USDS_LINEAR_PERPETUAL_ONE_WAY_V1",
  "summaryMatches": [
    {
      "candidateEpisodeIds": [
        "ep:partial-entry:01"
      ],
      "deltas": {
        "grossTradingPnl": {
          "scale": 0,
          "unscaled": "0"
        }
      },
      "episodeId": "ep:partial-entry:01",
      "exclusionReason": null,
      "sourceProvenance": [
        {
          "artifactRole": "POSITION_HISTORY",
          "sourceRecordKey": "position:position-history:1",
          "sourceRowNumber": 1
        }
      ],
      "status": "EXACT",
      "summaryRecordId": "partial-entry:position:1:summary",
      "summarySourceRow": 1,
      "tolerances": {
        "money": {
          "scale": 3,
          "unscaled": "5"
        },
        "price": {
          "scale": 3,
          "unscaled": "5"
        },
        "quantity": {
          "scale": 1,
          "unscaled": "5"
        }
      }
    }
  ]
}
