{
  "allocations": [
    {
      "action": "OPEN",
      "allocatedFeeByAsset": {
        "USDT": {
          "scale": 2,
          "unscaled": "0"
        }
      },
      "allocatedQuantity": {
        "scale": 0,
        "unscaled": "1"
      },
      "allocatedReportedPnl": {
        "scale": 0,
        "unscaled": "0"
      },
      "episodeId": "ep:position-pnl-mismatch:01",
      "executionRecordId": "position-pnl-mismatch:trade:910000001301:execution",
      "feeRecordId": "position-pnl-mismatch:trade:910000001301:fee",
      "reportedPnlRecordId": "position-pnl-mismatch:trade:910000001301:pnl",
      "sourceProvenance": [
        {
          "artifactRole": "TRADE_HISTORY",
          "sourceRecordKey": "trade:AAAUSDT:910000001301",
          "sourceRowNumber": 1
        }
      ]
    },
    {
      "action": "CLOSE",
      "allocatedFeeByAsset": {
        "USDT": {
          "scale": 2,
          "unscaled": "0"
        }
      },
      "allocatedQuantity": {
        "scale": 0,
        "unscaled": "1"
      },
      "allocatedReportedPnl": {
        "scale": 2,
        "unscaled": "200"
      },
      "episodeId": "ep:position-pnl-mismatch:01",
      "executionRecordId": "position-pnl-mismatch:trade:910000001302:execution",
      "feeRecordId": "position-pnl-mismatch:trade:910000001302:fee",
      "reportedPnlRecordId": "position-pnl-mismatch:trade:910000001302:pnl",
      "sourceProvenance": [
        {
          "artifactRole": "TRADE_HISTORY",
          "sourceRecordKey": "trade:AAAUSDT:910000001302",
          "sourceRowNumber": 2
        }
      ]
    }
  ],
  "canonicalManifestHash": "56fb10bbb34713919525c103326ed32299597d55bb584be6b70c3089f5cb8005",
  "canonicalManifestHashInputs": {
    "canonicalRecordContentHash": "8626073104dfbc2ebed486c22052b594f6cf6edbad31542b4d490b25954822ed",
    "instrumentTermsHash": "5e458341f034961318f4d5d33cedda47717979a8480d3c7f1c05ef8031f0aad5",
    "normalizerVersion": "fixture-v1",
    "reconstructionPolicyVersion": "BINANCE_USDS_LINEAR_PERPETUAL_ONE_WAY_V1",
    "sourceArtifactHashes": {
      "POSITION_HISTORY": "68366e161ec9aec42b2f3b8752f4562d53d1b833b41402e59ccc8fc4a8a88d90",
      "TRADE_HISTORY": "8ae93fdf828ae78e57a6d36f685654ce585dacaba4da043fd374459cdc0a5097"
    }
  },
  "conservation": {
    "feesByAsset": "PASSED",
    "passed": true,
    "quantity": "PASSED",
    "reportedPnl": "PASSED"
  },
  "episodes": [
    {
      "averageEntryPrice": {
        "denominator": {
          "scale": 0,
          "unscaled": "1"
        },
        "numerator": {
          "scale": 2,
          "unscaled": "1000"
        }
      },
      "averageExitPrice": {
        "denominator": {
          "scale": 0,
          "unscaled": "1"
        },
        "numerator": {
          "scale": 2,
          "unscaled": "1200"
        }
      },
      "capabilities": [
        "FEES",
        "INITIAL_EXPOSURE",
        "MAX_EXPOSURE",
        "POSITION_INCREASES",
        "POSITION_MODE_OBSERVED_COMPATIBLE",
        "POSITION_MODE_USER_DECLARED",
        "VENUE_REPORTED_PNL"
      ],
      "closedAt": "2026-01-02T01:05:01.000000Z",
      "closingVolume": {
        "scale": 0,
        "unscaled": "1"
      },
      "direction": "LONG",
      "eligible": false,
      "episodeId": "ep:position-pnl-mismatch:01",
      "exclusionReasons": [
        "PNL_MISMATCH"
      ],
      "executionRecordIds": [
        "position-pnl-mismatch:trade:910000001301:execution",
        "position-pnl-mismatch:trade:910000001302:execution"
      ],
      "grossTradingPnl": {
        "scale": 2,
        "unscaled": "200"
      },
      "initialNotional": {
        "scale": 2,
        "unscaled": "1000"
      },
      "initialQuantity": {
        "scale": 0,
        "unscaled": "1"
      },
      "instrumentId": "BINANCE:USDS_FUTURES:AAAUSDT",
      "maxNotional": {
        "scale": 2,
        "unscaled": "1000"
      },
      "maxQuantity": {
        "scale": 0,
        "unscaled": "1"
      },
      "netTradingPnl": null,
      "openedAt": "2026-01-02T01:00:01.000000Z",
      "openingVolume": {
        "scale": 0,
        "unscaled": "1"
      },
      "reconciliationStatus": "SUMMARY_MISMATCH",
      "reconstructionStatus": "COMPLETE",
      "sourceProvenance": [
        {
          "artifactRole": "TRADE_HISTORY",
          "sourceRecordKey": "trade:AAAUSDT:910000001301",
          "sourceRowNumber": 1
        },
        {
          "artifactRole": "TRADE_HISTORY",
          "sourceRecordKey": "trade:AAAUSDT:910000001302",
          "sourceRowNumber": 2
        },
        {
          "artifactRole": "POSITION_HISTORY",
          "sourceRecordKey": "position:position-history:1",
          "sourceRowNumber": 1
        }
      ],
      "tradingFeesByAsset": {
        "USDT": {
          "scale": 2,
          "unscaled": "0"
        }
      },
      "venuePositionSummaryRecordIds": [
        "position-pnl-mismatch:position:1:summary"
      ]
    }
  ],
  "fixtureId": "position-pnl-mismatch",
  "importResult": {
    "accepted": true,
    "failureCode": null
  },
  "manifestSchemaVersion": "1.0.0",
  "normalizerVersion": "fixture-v1",
  "orderedExecutionKeysByInstrument": {
    "BINANCE:USDS_FUTURES:AAAUSDT": [
      "trade:AAAUSDT:910000001301",
      "trade:AAAUSDT:910000001302"
    ]
  },
  "reconstructionPolicyVersion": "BINANCE_USDS_LINEAR_PERPETUAL_ONE_WAY_V1",
  "summaryMatches": [
    {
      "candidateEpisodeIds": [],
      "deltas": {
        "grossTradingPnl": {
          "scale": 2,
          "unscaled": "50"
        }
      },
      "episodeId": null,
      "exclusionReason": "PNL_MISMATCH",
      "sourceProvenance": [
        {
          "artifactRole": "POSITION_HISTORY",
          "sourceRecordKey": "position:position-history:1",
          "sourceRowNumber": 1
        }
      ],
      "status": "SUMMARY_MISMATCH",
      "summaryRecordId": "position-pnl-mismatch:position:1:summary",
      "summarySourceRow": 1,
      "tolerances": {
        "money": {
          "scale": 3,
          "unscaled": "5"
        },
        "price": {
          "scale": 3,
          "unscaled": "5"
        },
        "quantity": {
          "scale": 1,
          "unscaled": "5"
        }
      }
    }
  ]
}
