{
  "allocations": [
    {
      "action": "OPEN",
      "allocatedFeeByAsset": {
        "USDT": {
          "scale": 2,
          "unscaled": "2"
        }
      },
      "allocatedQuantity": {
        "scale": 0,
        "unscaled": "1"
      },
      "allocatedReportedPnl": {
        "scale": 0,
        "unscaled": "0"
      },
      "episodeId": "ep:fee-rebate:01",
      "executionRecordId": "fee-rebate:trade:910000000801:execution",
      "feeRecordId": "fee-rebate:trade:910000000801:fee",
      "reportedPnlRecordId": "fee-rebate:trade:910000000801:pnl",
      "sourceProvenance": [
        {
          "artifactRole": "TRADE_HISTORY",
          "sourceRecordKey": "trade:AAAUSDT:910000000801",
          "sourceRowNumber": 1
        }
      ]
    },
    {
      "action": "CLOSE",
      "allocatedFeeByAsset": {
        "USDT": {
          "scale": 2,
          "unscaled": "-1"
        }
      },
      "allocatedQuantity": {
        "scale": 0,
        "unscaled": "1"
      },
      "allocatedReportedPnl": {
        "scale": 2,
        "unscaled": "200"
      },
      "episodeId": "ep:fee-rebate:01",
      "executionRecordId": "fee-rebate:trade:910000000802:execution",
      "feeRecordId": "fee-rebate:trade:910000000802:fee",
      "reportedPnlRecordId": "fee-rebate:trade:910000000802:pnl",
      "sourceProvenance": [
        {
          "artifactRole": "TRADE_HISTORY",
          "sourceRecordKey": "trade:AAAUSDT:910000000802",
          "sourceRowNumber": 2
        }
      ]
    }
  ],
  "canonicalManifestHash": "ad00a100809e3ab205239adf5ce121ee2e3884316e82833226b4c427d93d4a46",
  "canonicalManifestHashInputs": {
    "canonicalRecordContentHash": "0ddf9005cb707264457a7e032119e5cbffb091adaf0e462b101d9d95aad4c8bf",
    "instrumentTermsHash": "5e458341f034961318f4d5d33cedda47717979a8480d3c7f1c05ef8031f0aad5",
    "normalizerVersion": "fixture-v1",
    "reconstructionPolicyVersion": "BINANCE_USDS_LINEAR_PERPETUAL_ONE_WAY_V1",
    "sourceArtifactHashes": {
      "POSITION_HISTORY": "ab8c80a387a680248c186dbd0ba94633ddb1a844feae267684878b1c5b239a6c",
      "TRADE_HISTORY": "7f305b818b161dcf4eb603348e26b4c977e3051ccb258b28295695dabe769b18"
    }
  },
  "conservation": {
    "feesByAsset": "PASSED",
    "passed": true,
    "quantity": "PASSED",
    "reportedPnl": "PASSED"
  },
  "episodes": [
    {
      "averageEntryPrice": {
        "denominator": {
          "scale": 0,
          "unscaled": "1"
        },
        "numerator": {
          "scale": 2,
          "unscaled": "1000"
        }
      },
      "averageExitPrice": {
        "denominator": {
          "scale": 0,
          "unscaled": "1"
        },
        "numerator": {
          "scale": 2,
          "unscaled": "1200"
        }
      },
      "capabilities": [
        "CLOSED_OUTCOME",
        "FEES",
        "INITIAL_EXPOSURE",
        "MAX_EXPOSURE",
        "POSITION_INCREASES",
        "POSITION_MODE_OBSERVED_COMPATIBLE",
        "POSITION_MODE_USER_DECLARED",
        "VENUE_POSITION_SUMMARY",
        "VENUE_REPORTED_PNL"
      ],
      "closedAt": "2026-01-02T01:05:01.000000Z",
      "closingVolume": {
        "scale": 0,
        "unscaled": "1"
      },
      "direction": "LONG",
      "eligible": true,
      "episodeId": "ep:fee-rebate:01",
      "exclusionReasons": [],
      "executionRecordIds": [
        "fee-rebate:trade:910000000801:execution",
        "fee-rebate:trade:910000000802:execution"
      ],
      "grossTradingPnl": {
        "scale": 2,
        "unscaled": "200"
      },
      "initialNotional": {
        "scale": 2,
        "unscaled": "1000"
      },
      "initialQuantity": {
        "scale": 0,
        "unscaled": "1"
      },
      "instrumentId": "BINANCE:USDS_FUTURES:AAAUSDT",
      "maxNotional": {
        "scale": 2,
        "unscaled": "1000"
      },
      "maxQuantity": {
        "scale": 0,
        "unscaled": "1"
      },
      "netTradingPnl": {
        "scale": 2,
        "unscaled": "199"
      },
      "openedAt": "2026-01-02T01:00:01.000000Z",
      "openingVolume": {
        "scale": 0,
        "unscaled": "1"
      },
      "reconciliationStatus": "EXACT",
      "reconstructionStatus": "COMPLETE",
      "sourceProvenance": [
        {
          "artifactRole": "TRADE_HISTORY",
          "sourceRecordKey": "trade:AAAUSDT:910000000801",
          "sourceRowNumber": 1
        },
        {
          "artifactRole": "TRADE_HISTORY",
          "sourceRecordKey": "trade:AAAUSDT:910000000802",
          "sourceRowNumber": 2
        },
        {
          "artifactRole": "POSITION_HISTORY",
          "sourceRecordKey": "position:position-history:1",
          "sourceRowNumber": 1
        }
      ],
      "tradingFeesByAsset": {
        "USDT": {
          "scale": 2,
          "unscaled": "1"
        }
      },
      "venuePositionSummaryRecordIds": [
        "fee-rebate:position:1:summary"
      ]
    }
  ],
  "fixtureId": "fee-rebate",
  "importResult": {
    "accepted": true,
    "failureCode": null
  },
  "manifestSchemaVersion": "1.0.0",
  "normalizerVersion": "fixture-v1",
  "orderedExecutionKeysByInstrument": {
    "BINANCE:USDS_FUTURES:AAAUSDT": [
      "trade:AAAUSDT:910000000801",
      "trade:AAAUSDT:910000000802"
    ]
  },
  "reconstructionPolicyVersion": "BINANCE_USDS_LINEAR_PERPETUAL_ONE_WAY_V1",
  "summaryMatches": [
    {
      "candidateEpisodeIds": [
        "ep:fee-rebate:01"
      ],
      "deltas": {
        "grossTradingPnl": {
          "scale": 0,
          "unscaled": "0"
        }
      },
      "episodeId": "ep:fee-rebate:01",
      "exclusionReason": null,
      "sourceProvenance": [
        {
          "artifactRole": "POSITION_HISTORY",
          "sourceRecordKey": "position:position-history:1",
          "sourceRowNumber": 1
        }
      ],
      "status": "EXACT",
      "summaryRecordId": "fee-rebate:position:1:summary",
      "summarySourceRow": 1,
      "tolerances": {
        "money": {
          "scale": 3,
          "unscaled": "5"
        },
        "price": {
          "scale": 3,
          "unscaled": "5"
        },
        "quantity": {
          "scale": 1,
          "unscaled": "5"
        }
      }
    }
  ]
}
