{
  "allocations": [],
  "canonicalManifestHash": "00668f49a8c37b92edd35c03c60cd127a87d4fa1e0a7a46c1fbf2a5252b54f87",
  "canonicalManifestHashInputs": {
    "canonicalRecordContentHash": "857e316c8169afdbe705bd4a28299555fbceab3c98f6077ba73349f6e0efd61e",
    "instrumentTermsHash": "5e458341f034961318f4d5d33cedda47717979a8480d3c7f1c05ef8031f0aad5",
    "normalizerVersion": "fixture-v1",
    "reconstructionPolicyVersion": "BINANCE_USDS_LINEAR_PERPETUAL_ONE_WAY_V1",
    "sourceArtifactHashes": {
      "POSITION_HISTORY": "6ebdf9cc0da0c08ed54bbd089803a9aebdb5ad462425b0ab8fd54d82c98dc7e9",
      "TRADE_HISTORY": "39001a8dcdaaf655ebe9ff1228e2421b8a6256fb3d57503da999fce847980992"
    }
  },
  "conservation": {
    "feesByAsset": "NOT_EVALUATED",
    "passed": null,
    "quantity": "NOT_EVALUATED",
    "reportedPnl": "NOT_EVALUATED"
  },
  "episodes": [],
  "fixtureId": "required-column-missing",
  "importResult": {
    "accepted": false,
    "failureCode": "REQUIRED_COLUMN_MISSING"
  },
  "manifestSchemaVersion": "1.0.0",
  "normalizerVersion": "fixture-v1",
  "orderedExecutionKeysByInstrument": {},
  "reconstructionPolicyVersion": "BINANCE_USDS_LINEAR_PERPETUAL_ONE_WAY_V1",
  "summaryMatches": []
}
